{"analyticalMisses": [], "analyticalWins": [], "canonicalTotals": {"netProfitLoss": 0, "roi": null, "totalReturned": 0, "totalRisked": 0}, "createdAt": "2026-08-24T03:45:08Z", "gameDate": "2026-08-18", "gameLevelConcentration": [], "linkedBetIds": [], "markdownPath": "data/edgelab/postmortems/2026-08-18/postmortem.md", "performanceByMarketFamily": [], "postmortemId": "16ec30be1e519dd26ef146d4c0056a2ed33d6d75", "processErrors": [{"betIds": [], "id": "no-per-wager-manifest-available", "summary": "Only an aggregate summary exists for 2026-08-18 (record 7-5, rounded risk $180, paid $195.96, P/L +$15.96, ROI +8.87%; non-pitcher bets 6-2 +$40.77; pitcher props 1-3 -$24.81). No exact 12-wager manifest (team/market/threshold/side/price per wager) was supplied, and an exhaustive repository search -- data/edgelab/bets/bets.jsonl, data/session_bets/, BET_LOG.md, data/lineup_audit_2026-08-18.*, data/f5_audit_2026-08-18.*, archive/data, archive/scripts, archive/workflows, all git branches/commit history including git log -S for 'manual-2026-08-18' -- found no per-wager manual-execution evidence anywhere. The only 2026-08-18 ledger row found is an unrelated $3 source=MODEL/entryMethod=LEGACY_BACKFILL bet (MIA@PHI ML_Away). data/execution_slip_2026-08-18.{json,txt} is the automated model's own paper-trading recommendation slip (1 real-money $3 rec, 64 paper, 100 rejected) -- a different system from the user's manual $180-risk slate, not evidence of it. Per explicit instruction, individual wagers were never reverse-engineered from the aggregate summary or from assistant/model recommendations. All implied wagers for this date are therefore BLOCKED_MISSING_EVIDENCE and none were imported.", "tags": ["BLOCKED_MISSING_EVIDENCE"]}], "proposedInvestigations": [{"betIds": [], "id": "locate-aug18-manifest", "summary": "If the user can supply the exact 12-wager manifest (team/market/threshold/side/displayed price/stake per wager, as was supplied for 2026-08-20 through 2026-08-23), this date can be reconciled through the same canonical import path (scripts/edgelab/import_bet_batch.py, importBatchId manual-2026-08-18-postmortem-v1) in a follow-up pass. Known qualitative lessons preserved for that follow-up: non-pitcher markets drove profit; PIT/LAD team totals were strong expressions; ATL/CWS theses were relatively thin; pitcher-prop confidence was too aggressive; favorite pricing does not make a pitcher prop low variance; an Arizona protected-F5 bet was executed beyond Bet Up To (logged as a price-discipline failure, not evidence the family should be default).", "tags": ["BLOCKED_MISSING_EVIDENCE"]}], "provenance": {"capturedAt": "2026-08-24T03:45:08Z", "ingestedAt": "2026-08-24T03:45:08Z", "sourceFile": null, "sourceKey": "2026-08-18", "sourceSystem": "postmortem_import"}, "recordStatus": "ACTIVE", "reportedTotals": {"netProfitLoss": 15.96, "roi": 8.87, "totalReturned": 195.96, "totalRisked": 180}, "revision": 1, "schemaVersion": "1", "source": "postmortem_import", "structuredFindings": {"analyticalMisses": [], "analyticalWins": [], "betIds": [], "blockedWagers": [{"detail": "All ~12 wagers for 2026-08-18 are blocked -- only an aggregate postmortem summary exists in the task description; no per-wager manifest was supplied and none exists anywhere in the repository or its git history. See processErrors for the full evidence-search record.", "reason": "BLOCKED_MISSING_EVIDENCE", "sourceBetKey": null}], "gameLevelConcentration": [], "performanceByMarketFamily": [], "processErrors": [{"betIds": [], "id": "no-per-wager-manifest-available", "summary": "Only an aggregate summary exists for 2026-08-18 (record 7-5, rounded risk $180, paid $195.96, P/L +$15.96, ROI +8.87%; non-pitcher bets 6-2 +$40.77; pitcher props 1-3 -$24.81). No exact 12-wager manifest (team/market/threshold/side/price per wager) was supplied, and an exhaustive repository search -- data/edgelab/bets/bets.jsonl, data/session_bets/, BET_LOG.md, data/lineup_audit_2026-08-18.*, data/f5_audit_2026-08-18.*, archive/data, archive/scripts, archive/workflows, all git branches/commit history including git log -S for 'manual-2026-08-18' -- found no per-wager manual-execution evidence anywhere. The only 2026-08-18 ledger row found is an unrelated $3 source=MODEL/entryMethod=LEGACY_BACKFILL bet (MIA@PHI ML_Away). data/execution_slip_2026-08-18.{json,txt} is the automated model's own paper-trading recommendation slip (1 real-money $3 rec, 64 paper, 100 rejected) -- a different system from the user's manual $180-risk slate, not evidence of it. Per explicit instruction, individual wagers were never reverse-engineered from the aggregate summary or from assistant/model recommendations. All implied wagers for this date are therefore BLOCKED_MISSING_EVIDENCE and none were imported.", "tags": ["BLOCKED_MISSING_EVIDENCE"]}], "proposedInvestigations": [{"betIds": [], "id": "locate-aug18-manifest", "summary": "If the user can supply the exact 12-wager manifest (team/market/threshold/side/displayed price/stake per wager, as was supplied for 2026-08-20 through 2026-08-23), this date can be reconciled through the same canonical import path (scripts/edgelab/import_bet_batch.py, importBatchId manual-2026-08-18-postmortem-v1) in a follow-up pass. Known qualitative lessons preserved for that follow-up: non-pitcher markets drove profit; PIT/LAD team totals were strong expressions; ATL/CWS theses were relatively thin; pitcher-prop confidence was too aggressive; favorite pricing does not make a pitcher prop low variance; an Arizona protected-F5 bet was executed beyond Bet Up To (logged as a price-discipline failure, not evidence the family should be default).", "tags": ["BLOCKED_MISSING_EVIDENCE"]}], "reportedTotals": {"netProfitLoss": 15.96, "roi": 8.87, "totalReturned": 195.96, "totalRisked": 180}}, "supersededBy": null, "totalsMatch": false, "unresolvedBetReferences": [], "updatedAt": null, "validationStatus": "valid"}
